game_id,nameOfGames,released_date,rating,summary
990,Final Fantasy XIV,2010-09-30,81.39087,"Take part in an epic and ever-changing Final Fantasy as you adventure and explore with friends from around the world. Final Fantasy XIV Online is the 2013 relaunch of the massively multiplayer online role-playing game that takes the wonder of the FF legacy and expands it, allowing you to explore the realm of Eorzea like never before in a Final Fantasy game.  Forge friendships, mount chocobos, and board airships as you and your companions create your own unique stories in Eorzea. Adventure alone or join up with friends to undertake epic quests, battle familiar Final Fantasy monsters, and acquire unique abilities and equipment. All the classic elements from the series that you have come to know and love are waiting! Embark of the adventure of a lifetime to help reforge the fate of Eorzea!"
991,Final Fantasy Tactics,1997-06-28,85.50515,Lead epic battles in a new FINAL FANTASY world. Betrayal and darker dealings await in Squaresoft's game of war. Fight hundreds of battles across dangerous 3D terrain as an ancient blood feud awakens a deadlier foe.
992,FINAL FANTASY III,2006-11-14,79.37995,The original Final Fantasy III comes to life with completely new graphics and audio! A remodeled 2D take on the third game in the world-renowned Final Fantasy series! Enjoy the timeless story told through charming retro graphics.
993,FINAL FANTASY XIII-2,2011-12-15,71.72678,"FINAL FANTASY XIII-2 is created with the aim of surpassing the quality of its predecessor in every way, featuring new gameplay systems and cutting-edge visuals and audio. In this game the player has the freedom to choose from a range of possibilities and paths; where their choices affect not only the immediate environment, but even shape time and space!"
994,FINAL FANTASY XIV: Shadowbringers,2019-07-02,90.57746,"Final Fantasy XIV: Shadowbringers is the third expansion pack to Final Fantasy XIV. The expansion takes players to the First, one of thirteen reflections of the Source that is being consumed by a Flood of Light. The main region visited is known as Norvrandt, which is roughly analogous to the Source's Eorzea, and is the only region in the world that has not yet succumbed to the Flood of Light."
995,Final Fantasy VIII Remastered,2019-09-03,70.79751,"Final Fantasy VIII Remastered retains its original 4:3 aspect ratio in both FMVs and real-time graphic rendering, but enhance visuals with several characters, enemies, GF, and objects refined to look better. The music is unchanged from the original PlayStation version."
996,Grand Theft Auto,1997-10-21,93.0813,"This bundle contains the original version of Grand Theft Auto V, the standalone game Grand Theft Auto Online and the story mode add-on of Grand Theft Auto V."
997,Grand Theft Auto IV,2008-04-29,83.32439,"Grand Theft Auto IV is an action-adventure video game developed by Rockstar North and published by Rockstar Games. It is the eleventh title in the Grand Theft Auto series, and the first main entry since 2004's Grand Theft Auto: San Andreas.  The game is played from a third-person perspective and its world is navigated on-foot or by vehicle. Throughout the single-player mode, players play as Niko Bellic. An online multiplayer mode is included with the game, allowing up to 32 players to engage in both co-operative and competitive gameplay in a recreation of the single-player setting.  Two expansion packs were later released for the game, The Lost and Damned and The Ballad of Gay Tony, which both feature new plots that are interconnected with the main Grand Theft Auto IV storyline, and follow new protagonists."
998,Grand Theft Auto V,2013-09-17,93.0813,"This bundle contains the original version of Grand Theft Auto V, the standalone game Grand Theft Auto Online and the story mode add-on of Grand Theft Auto V."
999,Grand Theft Auto: London 1961,1999-06-01,76.50943,"Grand Theft Auto: London, 1961 is a freely distributed mission pack to Grand Theft Auto and Grand Theft Auto: London, 1969. It is the third game in the series. Like London, 1969, it uses the same game engine as Grand Theft Auto. As the name implies, the game takes place in London in 1961, eight years before the events that took place in London, 1969. The 1961 setting makes this mission pack the earliest Grand Theft Auto game chronologically."
1000,Grand Theft Auto IV: Complete Edition,2010-10-27,87.9992,"This standalone retail title spans three distinct stories, interwoven to create one of the most unique and engaging single-player experiences of this generation. This definitive Grand Theft Auto bundle boasts hundreds of hours of single-player gameplay; a full suite of open-world multiplayer game types limited only by players’ creativity; dozens of eclectic radio stations with hours of music and original dialogue."
1001,Grand Theft Auto III: The Definitive Edition,2021-11-11,50.20943,"It all starts in Liberty City. With revolutionary freedom to go anywhere and jack anyone, Grand Theft Auto III puts the center of the criminal underworld at your fingertips, if you have enough guts to take it."
1002,Grand Theft Auto: Chinatown Wars,2009-03-17,77.93438,"Grand Theft Auto: Chinatown Wars is an entirely original entry into the critically acclaimed Grand Theft Auto series, and brings a new level of interactivity to its sprawling open environments. With the use of the DS touch screen, players navigate their way through the streets as they uncover the truth behind an epic tale of crime and corruption within the Triad crime syndicate, delivering the unprecedented amount of depth that has become a true trademark of the franchise."
1003,Grand Theft Auto: Vice City,2002-10-27,87.68044,"In the year 1986, Tommy Vercetti is heavily indebted to his mafia superiors after a drug deal gone awry, but his dreams of taking over Vice City (based on Miami) push him down a different path. Featuring a wide variety of vehicles and weapons, radio stations playing hit songs from the era and an intense atmosphere, GTA: Vice City is an open-world sandbox satire of '80's Miami."
1004,Grand Theft Auto: San Andreas,2004-10-26,90.56755,"Returning after his mother's murder to the semi-fictional city of Los Santos (based on Los Angeles), Carl Johnson, a former gang banger, must take back the streets for his family and friends by gaining respect and once again gaining control over the streets. However, a story filled with crime, lies and corruption will lead him to trudge the entire state of San Andreas (based on California and Nevada) to rebuild his life."
1005,Grand Theft Auto: iFruit,2013-09-16,0,A fictional app that appeared in GTA V is now usable in real life
1006,Grand Theft Auto: The Trilogy – The Definitive Edition,2021-11-11,69.89664,"Three iconic cities, three epic stories.  Play the genre-defining classics of the original Grand Theft Auto Trilogy: Grand Theft Auto III, Grand Theft Auto: Vice City, and Grand Theft Auto: San Andreas updated for a new generation, now with across-the-board enhancements including brilliant new lighting and environmental upgrades, with high-resolution textures, increased draw distances, Grand Theft Auto V-style controls and targeting, and much more, bringing these beloved worlds to life with all new levels of detail."
1007,Grand Theft Auto: San Andreas – The Definitive Edition,2021-11-11,50.08892,"It's the early '90s. After a couple of cops frame him for homicide, Carl ""CJ"" Johnson is forced on a journey that takes him across the entire state of San Andreas, to save his family and to take control of the streets."
1008,Grand Theft Auto: Vice City Stories,2006-10-31,75.76227,"The PlayStation Portable follow-up to Rockstar's monumental handheld entry in the series, Grand Theft Auto: Liberty City Stories. As in Liberty City Stories, this game ventures back to the location of the second PS2 game."
1009,Grand Theft Auto: Vice City – The Definitive Edition,2021-11-11,60.21811,"Welcome to the 1980s. Experience Tommy Vercetti’s tale of betrayal and revenge in the neon-soaked tropical sprawl of Vice City, a town brimming with excess, ready to be taken over, your way."
1010,Grand Theft Auto: Liberty City Stories,2005-10-24,73.40052,"There are a million stories in Liberty City. This one changes everything. Once a trusted wise guy in the Leone crime family, Toni Cipriani was forced into hiding after killing a made man. Now he's back and it's time for things to be put right.  The streets of Liberty City are in turmoil. Warring mafiosi vie for control as the town begins to self-destruct under waves of political corruption, organized crime, drug trafficking and union strikes. No one can be trusted as Toni tries to clean up the mess of the city's chaotic underworld. Deranged hit men, morally depraved tycoons, cynical politicians and his own mother stand in his way as Toni tries to bring the city under Leone control.  Forced to fight for his life in an odyssey that will shake Liberty City to its foundations, Toni must use any means necessary to secure his place in the leadership of the Leone family in a town up for grabs."
1011,Grand Theft Auto: Episodes from Liberty City,2009-10-29,80.19911,Episodes from Liberty City is a standalone compilation of the episodes: Grand Theft Auto IV: Ballad of Gay Tony and Grand Theft Auto IV: The Lost and Damned
1012,Grand Theft Auto IV: The Lost and Damned,2009-02-17,79.81055,"Grand Theft Auto IV: The Lost and Damned is the first of two episodic expansion packs of Grand Theft Auto IV. The Lost and Damned features a new protagonist, Johnny Klebitz, who is Vice President of the Alderney chapter of one percenter motorcycle club The Lost MC, a club which is featured in missions throughout the course of Grand Theft Auto IV. Dan Houser, vice-president of creative development at Rockstar Games, claims the episode shows ""a different side of Liberty City""."
1013,Grand Theft Auto: The Trilogy,2011-01-06,88.09671,A bundle that contains the original trilogy from one of the most popular and critically acclaimed franchises in entertainment history.  - GTA III - GTA Vice City - GTA San Andreas
1014,Mortal Kombat,1992-08-09,63,This compilation combines the Game Boy versions of:  - Mortal Kombat - Mortal Kombat II
1015,Mortal Kombat: Deception,2004-10-04,70.6335,"Mortal Kombat: Deception is the sixth installment in the Mortal Kombat franchise. Based on the Mortal Kombat: Deadly Alliance engine, players once again have to fight to stop this new threat in the sixth installment of the fighting series. The standard Arcade, Versus, and Practice modes return, as well as new items to be found in the Krypt. In addition, there are new Konquest Adventure, Chess Kombat, and Puzzle Kombat modes to give the player new mini-games.  The Playstation 2 and Xbox versions offer online, competitive play against other players. The Gamecube version does not include online play, but offers Goro and Shao Kahn as exclusive playable characters."
1016,Mortal Kombat: Armageddon,2006-10-11,73.10914,"Mortal Kombat: Armageddon brags a roster of 62 characters and sees the return of classic ones from the original Mortal Kombat, such as Reptile, Shang Tsung and Goro. The enhanced Konquest mode (story/adventure mode) improves over the preceding versions, but has a shorter length. There are now 64 arenas (including revamped versions of classic environments) which each have their own tweaks, such as the ridiculous amount of stage fatalities (fatalities are a fancy way of killing your opponent, including classic techniques such as the ""spine-rip"" or ""arm-break"")."
1017,Mortal Kombat: Unchained,2009-10-02,59.98079,"Mortal Kombat: Unchained is the portable equivalent of the console game Mortal Kombat: Deception. It contains all the characters from the GameCube version, along with four exclusive to the PSP version: Blaze, Frost, Jax and Kitana. All characters have a vast arsenal of moves, with weapons, and fatalities. The arenas are multi-tiered, interactive and contain death traps. Next to the regular battles, you can play a free-roaming adventure in the Konquest Mode, battle an endless wave of opponents in the Endurance Mode (exclusive for the PSP), go head-to-head over Wi-Fi against another human player, or try a mini-game such as Chess Kombat (chess with the MK characters) and Puzzle Kombat (Tetris with a twist)."
1018,Mortal Kombat 1,2023-09-19,76.74417,"A new era has begun. It's In Our Blood. Discover a reborn Mortal Kombat Universe created by Fire God Liu Kang. Mortal Kombat 1 ushers in a new era of the iconic franchise with a new fighting system, game modes, and Fatalities!"
1019,Mortal Kombat X,2015-04-07,0,A cancelled port of Mortal Kombat X for PlayStation 3 and Xbox 360.
1020,Mortal Kombat Komplete Edition,2013-07-03,81.32974,"This Komplete Edition is a re-release of the original game. It includes the full game, alongside all previously released downloadable content. It also includes the Mortal Kombat: Songs Inspired by the Warriors album (including a bonus track) and the 1995 Mortal Kombat movie for download, via the PlayStation Store or Xbox Live Zune.  For the PS Vita and Windows this is the first release of the game. It has the same content as well as new costumes and a new Challenge Tower (Vita version only) not featured in the versions for other platforms."
1021,Mortal Kombat Arcade Kollection,2011-08-30,70.0064,"Mortal Kombat Arcade Kollection is a 2011 video game developed by Other Ocean Interactive and published by Warner Bros. Games. It is a compilation of three classic 2D fighting games in the Mortal Kombat series: Mortal Kombat (1992), Mortal Kombat II (1993) and Ultimate Mortal Kombat 3 (1995).  The game was created after an ambitious previous incarnation, a HD remake project titled Mortal Kombat HD Arcade Kollection, was cancelled."
1022,Mortal Kombat: Special Forces,2000-06-30,45.04952,"Take on the role of Mortal Kombat character Jax, as you descend into the realm of Mortal Kombat in search of arch- villain, Kano. As you make your way through the game, you will delve deeper into one of the most interesting and enigmatic stories in the Mortal Kombat universe. Battle your way through complex 3D levels. Destroy your enemies using never-before-seen special moves and combos, all leading to an unforeseen climactic ending."
1023,Mortal Kombat: Deadly Alliance,2002-11-16,58.54166,"Mortal Kombat: Deadly Alliance is the first Mortal Kombat outing on the next-gen systems. New to DA is a completely revamped fight engine. The graphics are in full 3D and feature somewhat interactive environments. Each character now has different fighting stances, allowing them to be in an offensive stance or a fatality stance.  Returning from past games are all your favorite fighters, and a host of new ones. Johnny Cage, Scorpion, Sub-Zero, Raiden, joined by such newcomers as Molloch and Quan Chi. Each character has their own specific fatalities."
1024,Mortal Kombat 11: Aftermath,2020-05-26,0,"The epic saga continues with Mortal Kombat 11: Aftermath! This new entry expands the critically acclaimed story campaign of Mortal Kombat 11 with an all-new cinematic narrative centered around trust and deceit. Joining the fight will be Mortal Kombat alumni, Fujin and Sheeva, and guest character, RoboCop, making his series debut!"
1025,Mortal Kombat: Shaolin Monks,2005-09-16,67.62369,"Mortal Kombat: Shaolin Monks is a 3D platforming adventure beat-em-up that is based in the Mortal Kombat world. The combat is fast-paced, with numerous ways to dispose of enemies, including MK signature moves and Fatalities. This kombat goes beyond what you have seen in the fighting games, among the upgrades are: The series first Multi-Directional Kombat System, Multalities (kill multiple opponents with one move), Brutalities (see red as you unleash brutal force), ko-op only team-attacks, and even character progression (earn experience to spend on upgrades to moves). The backgrounds, all based on MK and MK II arenas, come to life with numerous hazards for the Monks that they can turn on their enemies."
1026,Mortal Kombat 11 Ultimate,2020-11-17,89.85763,"The definitive MK11 experience! Take control of Earthrealm's protectors in the game's TWO critically acclaimed, time-bending Story Campaigns as they race to stop Kronika from rewinding time and rebooting history. Friendships are tested, and new alliances forged, in the battle to save all of existence. MK11 Ultimate features the komplete 37-character roster, including new additions Rain, Mileena & Rambo."
1027,Mortal Kombat Mythologies: Sub-Zero,1997-10-01,0,
1028,Mortal Kombat vs. DC Universe,2008-11-16,59.94578,"In this arcade-style fighting game, both DC and Mortal Kombat universes are represented by 10 champions each, and one ""boss"" character, for a total of 22 fighters. Play is similar to the 2D Mortal Kombat games (with some 3D elements), focusing more on the special move aspect than the complex combos found in the previous three games (Deadly Alliance, Deception, Armageddon).  As with any Mortal Kombat game, Fatalities are still present for the Kombatants and villains, though slightly toned down to meet the DC standards of heroes such as Superman and Batman keeping to their moral code and not killing their opponent. As a result, the DC heroes perform ""Heroic Brutalities"", which effectively put their opponent out of commission."
1029,Mortal Kombat MOBILE,2015-04-07,79.87426,Mortal Kombat X is a mobile game based on the console game of the same name.
1030,Mortal Kombat Trilogy,1996-09-01,0,
1031,Mortal Kombat 4,1997-09-10,0,"Mortal Kombat 3, better known by its mapper hack, Mortal Kombat 4, is a pirated fighting game that was developed by Hummer Team and published by Ka Sheng, with MK4 later re-released by ABAB Soft on a multicart. The game is based on Mortal Kombat 3."
1032,Mortal Kombat 2,1993-06-25,0,Mortal Kombat II is a pirated port of Mortal Kombat made by Cony Soft (known as Yoko Soft in this game) in 1994. This should not be mistaken for Mortal Kombat II (Hummer Team).
1033,Far Cry,2004-03-22,0,Dive into the savage universe of Far Cry with this double-pack edition featuring both Far Cry 4 and Far Cry: Primal. Get ready to explore breathtaking landscapes featuring a varied wildlife and hostile enemies in this reference in the open world FPS genre.
1034,Far Cry 2,2008-10-21,72.47432,"A civil war has swept through the country and you're caught in the middle of it. Track down the person at the forefront of the fighting, a ruthless arms dealer known only as ""The Jackal"". As you undertake deadly missions and form fragile alliances with conflicting rebel groups, one thing becomes clear - the Jackal is hunting you too."
1035,Far Cry New Dawn,2019-02-15,67.06794,"Dive into a transformed vibrant post-apocalyptic Hope County, Montana, 17 years after a global nuclear catastrophe. Lead the fight against the Highwaymen, as they seek to take over the last remaining resources."
1036,Far Cry 6,2021-10-07,71.39383,"Dive into the gritty world of a modern-day guerrilla revolution to liberate a nation from its oppressive dictators. Welcome to Yara, a tropical paradise frozen in time. Far Cry 6 thrusts players into a modern-day guerrilla revolution. As dictator of Yara, Anton Castillo is intent on restoring his nation back to its former glory by any means, with his son, Diego, following in his bloody footsteps. Become a guerrilla fighter and liberate Yara."
1037,Far Cry 3: Blood Dragon,2013-04-30,78.55695,"The year is 2007. It is the future.  You are Sergeant Rex Colt: Mark IV Cyber Commando. The year is 2007 and Earth has been ravaged by a nuclear war which erupted in the 90s. The east vs. west conflict has raged for generations, and humanity continues to struggle to progress after a disastrous decade. New paths for peace must be found, and the US cyborg army may have found a solution: a powerful bioweapon on a distant island. Your mission is to gather information and figure out what the hell is going on."
1038,Far Cry Instincts: Predator,2006-03-27,69.97302,"Far Cry Instincts: Predator, a Xbox 360 title, was released March 27, 2006. Predator is a graphically enhanced version of both Far Cry Instincts and Far Cry Instincts: Evolution."
1039,Far Cry 5 - Lost On Mars,2018-07-17,51.85423,"Lost on Mars transports the franchise’s insanity from Hope County to the red planet as Nick Rye is teleported to a hostile planet to help his buddy Hurk thwart an alien invasion of Earth. This adventure gives players a new arsenal of alien weaponry, including the Blaster of Disaster, Hellfire and Morphinator, while also introducing a new traversal tool with Space Jets. Humankind’s future is in the hands of the game’s most notorious guns-for-hire. Time to squash some bugs!"
1040,Far Cry 5 - Hours of Darkness,2018-06-05,54.17573,"Hours of Darkness, the first of three planned DLC expansions for Far Cry 5, will be out on June 5. The expansion will move the game from Hope County to the sweltering jungles of the Vietnam War, where local boy Wendell ""Red"" Redler will embark upon a mission to rescued his captured comrades.  The expansion will add new weapons to the game, including the M16 rifle, the SVD sniper rifle, and the M60 machine gun, all of which will also be usable in the main campaign. You'll also have the ability to call in ""bombing airstrikes,"" which will presumably deliver more bang-for-the-buck than Hurk's mom's helicopter, and a new Survival Instinct feature that grants up to four temporary perks for accumulating stealth kills."
1041,Far Cry 5 - Dead Living Zombies,2018-08-28,43.1283,"Survive the horrors of Dead Living Zombies, the final DLC pack for Far Cry 5. Team up with a friend and smash your way through ravenous zombie hordes in 7 thrilling cinematic scenarios.  7 ZOMBIE-MOVIE THEMED MAPS Picture this: zombies and Far Cry combine in over-the-top cinematic mayhem. • Experience 7 action-packed movie scripts as pitched by director Guy Marvel. • Fight the living dead across city rooftops, farmland, military bases, and more.  NEW ZOMBIE ENEMIES Come face to face with the walking, running, and thundering dead. • Take down waves of zombies, from agile Gougers to explosive Hot Heads and powerful Behemoths.  SCORE ATTACK Challenge your best score to perfect each map. • Unlock Score Attack mode for each map, and surpass the best score to earn one, two, or three stars. • A 3-star rating unlocks weapons and gear you can bring back to the main campaign.  Also available in the Far Cry 5 Gold Edition and Season Pass."
1042,Far Cry Vengeance,2006-12-12,30.50095,"The game takes full advantage of the Wii Remote and its Nunchuk attachment. For example, the player can make the character jump by lifting the nunchuk. Weapons are aimed by pointing the Wii Remote at the screen, and melee attacks are carried out by making a slashing motion with it. The zoom on sniper rifles will similarly be controlled by moving the Wii Remote towards the television. Split screen Chaos mode (standard deathmatch) is included."
1043,Far Cry Primal,2016-02-23,72.17873,"Gamers play as TAKKAR, a seasoned hunter and the last surviving member of his hunting group. Arriving in the majestic and savage land of Oros, players will pursue one single goal; survive in a world where humans are the prey. They will meet a cast of memorable characters who will help them push back and tame the dangers of the wild.  Players will journey as the first human to tame the wilderness and rise above extinction. Along the way, they will have to hunt for food, master fire, fend off fierce predators, craft weapons and tools partly from the bones of slain beasts, and face off against other tribes to conquer Oros."
1044,Far Cry 5,2018-03-27,0,"It's time to defend Hope County with this bundle featuring both Far Cry 5 and Far Cry New Dawn  Far Cry 5 Welcome to Hope County, Montana. This idyllic place is home to a community of freedom-loving people - and a fanatical doomsday cult is known as The Project at Eden's Gate. Led by the charismatic prophet Joseph Seed and his devoted siblings - The Heralds - Eden's Gate has been quietly infiltrating every aspect of daily life in this once-quiet town. When your arrival incites the cult to violently seize control of the region, you must rise up and spark the fires of resistance to liberate a besieged community.  Far Cry New Dawn Dive into a transformed vibrant post-apocalyptic Hope County, Montana, 17 years after a global nuclear catastrophe. Join fellow survivors and lead the fight against the dangerous new threat the Highwaymen, and their ruthless leaders The Twins, as they seek to take over the last remaining resources."
1045,Far Cry 4,2014-11-18,0,Dive into the savage universe of Far Cry with this double-pack edition featuring both Far Cry 4 and Far Cry: Primal. Get ready to explore breathtaking landscapes featuring a varied wildlife and hostile enemies in this reference in the open world FPS genre.
1046,Far Cry Instincts: Evolution,2006-03-28,0,A sequel to Far Cry: Instincts with a different campaign.
1047,Far Cry 3,2012-11-28,83.82835,"Beyond the reach of civilization lies a lawless island ruled by violence. This is where you find yourself stranded, caught in a bloody conflict between the island’s psychotic warlords and indigenous rebels. Struggling to survive, your only hope of escape is through the muzzle of a gun. Discover the island’s dark secrets and take the fight to the enemy; improvise and use your environment to your advantage; and outwit its cast of ruthless, deranged inhabitants. Beware the beauty and mystery of this island of insanity… Where nothing is what is seems, you’ll need more than luck to escape alive."
